{
  "opening_time": 0,
  "closing_time": 1440,
  "min_duration": 30,
  "max_consecutive_genre": 2,
  "channels_count": 2,
  "switch_penalty": 10,
  "termination_penalty": 20,
  "priority_blocks": [
    {
      "start": 0,
      "end": 135,
      "allowed_channels": [
        1,
        0
      ]
    },
    {
      "start": 720,
      "end": 780,
      "allowed_channels": [
        0,
        1
      ]
    },
    {
      "start": 1215,
      "end": 1440,
      "allowed_channels": [
        0,
        1
      ]
    }
  ],
  "time_preferences": [
    {
      "start": 0,
      "end": 57,
      "preferred_genre": "movie",
      "bonus": 59
    },
    {
      "start": 57,
      "end": 114,
      "preferred_genre": "unknown",
      "bonus": 54
    },
    {
      "start": 114,
      "end": 171,
      "preferred_genre": "unknown",
      "bonus": 54
    },
    {
      "start": 171,
      "end": 228,
      "preferred_genre": "unknown",
      "bonus": 54
    },
    {
      "start": 228,
      "end": 285,
      "preferred_genre": "unknown",
      "bonus": 54
    },
    {
      "start": 285,
      "end": 342,
      "preferred_genre": "unknown",
      "bonus": 54
    },
    {
      "start": 342,
      "end": 399,
      "preferred_genre": "unknown",
      "bonus": 58
    },
    {
      "start": 399,
      "end": 456,
      "preferred_genre": "news",
      "bonus": 20
    },
    {
      "start": 456,
      "end": 513,
      "preferred_genre": "news",
      "bonus": 20
    },
    {
      "start": 513,
      "end": 570,
      "preferred_genre": "news",
      "bonus": 20
    },
    {
      "start": 570,
      "end": 627,
      "preferred_genre": "news",
      "bonus": 20
    },
    {
      "start": 627,
      "end": 684,
      "preferred_genre": "talk",
      "bonus": 20
    },
    {
      "start": 684,
      "end": 741,
      "preferred_genre": "talk",
      "bonus": 20
    },
    {
      "start": 741,
      "end": 798,
      "preferred_genre": "talk",
      "bonus": 20
    },
    {
      "start": 798,
      "end": 855,
      "preferred_genre": "talk",
      "bonus": 20
    },
    {
      "start": 855,
      "end": 912,
      "preferred_genre": "talk",
      "bonus": 20
    },
    {
      "start": 912,
      "end": 969,
      "preferred_genre": "talk",
      "bonus": 20
    },
    {
      "start": 969,
      "end": 1026,
      "preferred_genre": "talk",
      "bonus": 20
    },
    {
      "start": 1026,
      "end": 1083,
      "preferred_genre": "movie",
      "bonus": 20
    },
    {
      "start": 1083,
      "end": 1140,
      "preferred_genre": "movie",
      "bonus": 20
    },
    {
      "start": 1140,
      "end": 1197,
      "preferred_genre": "movie",
      "bonus": 20
    },
    {
      "start": 1197,
      "end": 1254,
      "preferred_genre": "movie",
      "bonus": 20
    },
    {
      "start": 1254,
      "end": 1311,
      "preferred_genre": "movie",
      "bonus": 20
    },
    {
      "start": 1311,
      "end": 1368,
      "preferred_genre": "movie",
      "bonus": 20
    },
    {
      "start": 1368,
      "end": 1425,
      "preferred_genre": "movie",
      "bonus": 20
    },
    {
      "start": 1425,
      "end": 1440,
      "preferred_genre": "movie",
      "bonus": 20
    }
  ],
  "channels": [
    {
      "channel_id": 0,
      "channel_name": "BY - НТВ-Беларусь",
      "programs": [
        {
          "program_id": "by__2026-01-07_0000",
          "start": 0,
          "end": 255,
          "genre": "unknown",
          "score": 57
        },
        {
          "program_id": "by_i_2026-01-07_0265",
          "start": 265,
          "end": 310,
          "genre": "unknown",
          "score": 68
        },
        {
          "program_id": "by__2026-01-07_0325",
          "start": 325,
          "end": 360,
          "genre": "unknown",
          "score": 57
        }
      ]
    },
    {
      "channel_id": 1,
      "channel_name": "BY - Т24",
      "programs": [
        {
          "program_id": "24_by__2026-01-07_0000",
          "start": 0,
          "end": 35,
          "genre": "movie",
          "score": 81
        },
        {
          "program_id": "24_by__2026-01-07_0035",
          "start": 35,
          "end": 135,
          "genre": "unknown",
          "score": 57
        }
      ]
    }
  ]
}